name,ring,quadrant,status,description
Electronic Health Records Integration,adopt,techniques,no change,"<p><strong>Electronic Health Records (EHR) Integration</strong> has become fundamental to modern healthcare IT. Standards like HL7 FHIR enable interoperability between healthcare systems, improving care coordination and reducing data silos.</p><p>Our teams have successfully implemented FHIR-based integrations with major EHR platforms including Epic, Cerner, and Allscripts. The investment in standardised APIs pays dividends in reduced integration complexity.</p><p>We recommend establishing a robust integration layer using FHIR R4 as the baseline, with proper audit logging and consent management for patient data access.</p>"
Clinical Decision Support Systems,adopt,techniques,moved in,"<p><strong>Clinical Decision Support Systems (CDSS)</strong> leverage data analytics and evidence-based guidelines to assist healthcare providers in making informed decisions. These systems have demonstrated measurable improvements in patient outcomes.</p><p>Modern CDSS implementations integrate seamlessly with EHR workflows, providing real-time alerts for drug interactions, diagnostic suggestions, and treatment recommendations based on clinical guidelines.</p><p>Key success factors include clinician involvement in system design, appropriate alert thresholds to avoid fatigue, and continuous monitoring of clinical outcomes.</p>"
Continuous Glucose Monitoring Integration,adopt,techniques,new,"<p><strong>Continuous Glucose Monitoring (CGM) Integration</strong> enables real-time tracking of glucose levels for diabetic patients. The integration of CGM data with health platforms provides comprehensive diabetes management capabilities.</p><p>APIs from providers like Dexcom and Abbott FreeStyle Libre enable developers to build applications that provide insights, alerts, and trend analysis for patients and healthcare providers.</p><p>Privacy considerations are paramount - ensure proper consent mechanisms and data encryption for this sensitive health information.</p>"
Telemedicine Platform Architecture,adopt,techniques,no change,"<p><strong>Telemedicine Platform Architecture</strong> has become essential infrastructure following global healthcare transformation. Well-designed platforms balance accessibility, clinical workflow integration, and regulatory compliance.</p><p>Key architectural considerations include video consultation quality, EHR integration, e-prescribing capabilities, and mobile-first design for patient accessibility.</p><p>HIPAA compliance, data residency requirements, and clinical documentation workflows must be addressed from the initial design phase.</p>"
Patient Data Anonymisation,adopt,techniques,no change,"<p><strong>Patient Data Anonymisation</strong> techniques enable the use of healthcare data for research and analytics while protecting patient privacy. Proper de-identification is essential for regulatory compliance and ethical data use.</p><p>Techniques include k-anonymity, differential privacy, and synthetic data generation. The choice depends on the use case, data sensitivity, and analysis requirements.</p><p>Regularly audit anonymisation effectiveness and stay current with evolving privacy regulations like HIPAA, GDPR, and state-specific healthcare privacy laws.</p>"
AI-Assisted Diagnostics,trial,techniques,new,"<p><strong>AI-Assisted Diagnostics</strong> applies machine learning to medical imaging, pathology, and diagnostic processes. These systems augment clinical expertise with pattern recognition capabilities that can detect subtle abnormalities.</p><p>Applications include radiology image analysis (CT, MRI, X-ray), pathology slide analysis, and dermatology lesion classification. FDA-cleared solutions are increasingly available for clinical use.</p><p>Implementation requires careful validation, clinician training, and clear protocols for how AI recommendations integrate with clinical decision-making. Human oversight remains essential.</p>"
Federated Learning for Healthcare,trial,techniques,new,"<p><strong>Federated Learning</strong> enables training machine learning models across distributed healthcare datasets without centralising sensitive patient data. This approach addresses privacy concerns while enabling collaborative model development.</p><p>Healthcare organisations can contribute to model training while keeping patient data within their own infrastructure. The technique is particularly valuable for rare disease research where single-institution datasets are insufficient.</p><p>Challenges include communication overhead, heterogeneous data quality, and ensuring model fairness across diverse patient populations.</p>"
Remote Patient Monitoring,trial,techniques,moved in,"<p><strong>Remote Patient Monitoring (RPM)</strong> enables healthcare providers to track patient health data outside traditional clinical settings. IoT devices, wearables, and connected health platforms transmit vital signs and symptoms data.</p><p>RPM has proven effective for chronic disease management, post-surgical recovery, and elderly care. The COVID-19 pandemic accelerated adoption and demonstrated clinical value.</p><p>Success requires thoughtful alert thresholds, clinical workflow integration, and patient engagement strategies. Consider the digital literacy and access requirements of your patient population.</p>"
Precision Medicine Workflows,trial,techniques,no change,"<p><strong>Precision Medicine Workflows</strong> incorporate genetic, environmental, and lifestyle data to tailor treatments to individual patients. This approach moves beyond one-size-fits-all medicine to personalised care.</p><p>Implementation requires integration of genomic data, decision support for variant interpretation, and clinical pathways that incorporate genetic insights into treatment decisions.</p><p>Partner with genetic counsellors and specialist clinicians to design workflows that appropriately incorporate genomic information into care decisions.</p>"
Digital Therapeutics,assess,techniques,new,"<p><strong>Digital Therapeutics (DTx)</strong> are evidence-based therapeutic interventions delivered through software to treat, manage, or prevent medical conditions. Unlike wellness apps, DTx products undergo clinical validation and regulatory review.</p><p>Applications include mental health treatment (CBT delivery), chronic disease management, and substance abuse recovery support. Some DTx products have achieved FDA clearance and payer reimbursement.</p><p>We're assessing DTx platforms for integration into care delivery models. Consider clinical evidence, regulatory status, and reimbursement pathways when evaluating solutions.</p>"
Ambient Clinical Intelligence,assess,techniques,new,"<p><strong>Ambient Clinical Intelligence</strong> uses AI to automatically document clinical encounters, reducing physician administrative burden. Systems like Nuance DAX and Amazon's AWS HealthScribe capture and structure clinical conversations.</p><p>The promise is significant - physicians spend substantial time on documentation rather than patient care. Ambient documentation could reclaim this time while improving documentation quality.</p><p>We're assessing these technologies for pilot implementations. Key considerations include accuracy, specialty-specific performance, and integration with existing EHR documentation workflows.</p>"
Blockchain for Clinical Trials,hold,techniques,moved out,"<p><strong>Blockchain for Clinical Trials</strong> was explored for ensuring data integrity and consent management in research settings. However, practical implementations have not delivered promised benefits.</p><p>The complexity and overhead of blockchain solutions typically exceed the value provided compared to traditional audit trails and digital signature approaches.</p><p>For clinical trial data integrity, we recommend established GCP-compliant systems with proper audit logging rather than blockchain-based approaches.</p>"
HL7 FHIR R4,adopt,platforms,no change,"<p><strong>HL7 FHIR R4</strong> is the standard for healthcare data exchange. The RESTful API approach makes healthcare interoperability accessible to modern development teams, unlike legacy standards like HL7 v2.</p><p>Major EHR vendors now provide FHIR APIs, and regulatory requirements (21st Century Cures Act) mandate FHIR support. The ecosystem of FHIR implementation guides for specific use cases continues to grow.</p><p>Invest in FHIR expertise and establish organisational FHIR profiles for consistent data representation across applications.</p>"
Epic MyChart Integration,adopt,platforms,no change,"<p><strong>Epic MyChart Integration</strong> provides patient-facing access to health information from Epic EHR systems. The platform's widespread adoption among major health systems makes it a critical integration point.</p><p>Epic's App Orchard marketplace enables third-party applications to integrate with Epic systems. SMART on FHIR apps provide a standardised integration approach.</p><p>Plan for Epic's certification requirements and security reviews when building applications for the Epic ecosystem.</p>"
AWS HealthLake,trial,platforms,new,"<p><strong>AWS HealthLake</strong> is a HIPAA-eligible service that enables healthcare organisations to store, transform, and analyse health data at scale using FHIR format.</p><p>HealthLake provides natural language processing for unstructured medical data, enabling extraction of clinical concepts from clinical notes. The integration with AWS analytics services enables sophisticated health data analysis.</p><p>We're trialling HealthLake for building analytics platforms on healthcare data. Consider the data residency requirements and vendor lock-in implications for your organisation.</p>"
Google Cloud Healthcare API,trial,platforms,no change,"<p><strong>Google Cloud Healthcare API</strong> provides managed services for storing and accessing healthcare data in FHIR, HL7v2, and DICOM formats. The platform enables building healthcare applications on Google Cloud infrastructure.</p><p>Strong integration with BigQuery and AI Platform enables advanced analytics and machine learning on healthcare data. HIPAA compliance is available with appropriate BAA agreements.</p><p>Evaluate Google Cloud Healthcare API alongside AWS HealthLake for cloud-native healthcare platforms. Consider your existing cloud investments and specific feature requirements.</p>"
Azure Health Data Services,trial,platforms,moved in,"<p><strong>Azure Health Data Services</strong> provides managed FHIR, DICOM, and MedTech services for healthcare data. The platform integrates with Microsoft's healthcare ecosystem including Teams for Healthcare and Power Platform.</p><p>For organisations with Microsoft enterprise agreements and existing Azure investments, Health Data Services provides a natural fit for healthcare workloads.</p><p>The FHIR service supports SMART on FHIR authentication and integrates with Azure Active Directory for enterprise identity management.</p>"
Redox Platform,trial,platforms,no change,"<p><strong>Redox</strong> provides an integration platform that simplifies connections between healthcare applications and EHR systems. Rather than building individual integrations, developers work with Redox's standardised API.</p><p>For organisations building healthcare applications that need EHR connectivity, Redox accelerates time to market and reduces integration maintenance burden.</p><p>Evaluate Redox's pre-built connections to your target EHR systems and consider the per-transaction pricing model for your use case volume.</p>"
Apple HealthKit,trial,platforms,no change,"<p><strong>Apple HealthKit</strong> provides a centralised repository for health data on iOS devices. Integration enables applications to read and write health metrics with user consent.</p><p>For consumer health applications, HealthKit integration is often expected by users. The framework handles sensitive health data with appropriate privacy controls.</p><p>Design with privacy-first principles, requesting only necessary data categories and clearly communicating data usage to users.</p>"
Cerner Millennium Platform,assess,platforms,no change,"<p><strong>Cerner Millennium</strong> remains a major EHR platform, particularly following Oracle's acquisition of Cerner. The platform's future direction under Oracle ownership is still evolving.</p><p>Existing Cerner integrations via FHIR and proprietary APIs continue to function. Oracle's healthcare strategy will influence future development priorities.</p><p>Monitor Oracle's roadmap for Cerner and healthcare cloud services. Consider integration approaches that provide flexibility if platform changes occur.</p>"
SMART on FHIR,adopt,languages & frameworks,moved in,"<p><strong>SMART on FHIR</strong> provides a standard framework for building applications that integrate with EHR systems. The combination of OAuth 2.0 authentication with FHIR data access enables portable healthcare applications.</p><p>SMART on FHIR apps can be embedded within EHR workflows, providing clinicians with additional functionality without leaving their primary system.</p><p>The SMART App Launch Framework and Clinical Data Standards (US Core) provide the foundation for interoperable healthcare applications.</p>"
React Native for Health Apps,adopt,languages & frameworks,no change,"<p><strong>React Native</strong> enables building cross-platform mobile health applications with native performance. The framework's component model and large ecosystem support rapid development of patient-facing applications.</p><p>For telemedicine apps, patient portals, and wellness applications, React Native provides an efficient path to iOS and Android deployment from a single codebase.</p><p>Consider native development for applications requiring deep HealthKit/Health Connect integration or complex medical device connectivity.</p>"
Python for Health Informatics,adopt,languages & frameworks,no change,"<p><strong>Python</strong> is the dominant language for healthcare data science and bioinformatics. Libraries like Pandas, NumPy, and specialised packages like BioPython and PyHealth enable sophisticated health data analysis.</p><p>For clinical informatics, machine learning on health data, and research applications, Python's ecosystem is unmatched. Integration with clinical data through FHIR clients simplifies data access.</p><p>Invest in data governance practices when working with health data in Python - ensure proper de-identification, access controls, and audit logging.</p>"
FastAPI for Health APIs,trial,languages & frameworks,new,"<p><strong>FastAPI</strong> provides an excellent foundation for building healthcare APIs. The automatic OpenAPI documentation, request validation, and async support align well with healthcare interoperability requirements.</p><p>Combined with FHIR libraries and proper security middleware, FastAPI enables rapid development of compliant healthcare services.</p><p>We're adopting FastAPI for new Python-based healthcare API development, replacing Flask for new projects.</p>"
Flutter for Patient Apps,trial,languages & frameworks,moved in,"<p><strong>Flutter</strong> provides an alternative to React Native for cross-platform mobile development. The framework's performance characteristics and widget system enable polished patient-facing applications.</p><p>For applications requiring custom UI and smooth animations, Flutter often provides better results than React Native. The single codebase supports iOS, Android, and web deployment.</p><p>Evaluate Flutter's health platform integrations (HealthKit, Health Connect) for your specific requirements before committing to the framework.</p>"
TypeScript for Healthcare,adopt,languages & frameworks,no change,"<p><strong>TypeScript</strong> provides type safety that's particularly valuable in healthcare applications where data integrity matters. The compile-time checking catches errors that could have clinical significance.</p><p>For FHIR-based applications, TypeScript definitions for FHIR resources provide excellent developer experience and reduce mapping errors.</p><p>Use TypeScript for all new healthcare JavaScript/Node.js development. The investment in types pays dividends in maintainability and reliability.</p>"
Kotlin Multiplatform for Mobile Health,assess,languages & frameworks,new,"<p><strong>Kotlin Multiplatform</strong> enables sharing business logic across iOS and Android while maintaining native UIs. For healthcare applications, this approach can ensure consistent data handling and validation across platforms.</p><p>The ability to share clinical logic implementations reduces the risk of platform-specific bugs in critical healthcare calculations.</p><p>We're assessing Kotlin Multiplatform for scenarios where clinical logic consistency is paramount and native UI integration is preferred over cross-platform UI frameworks.</p>"
HAPI FHIR,adopt,tools,no change,"<p><strong>HAPI FHIR</strong> is the leading open-source FHIR implementation in Java. It provides a complete FHIR server, client library, and validation tools for building healthcare interoperability solutions.</p><p>For organisations building FHIR infrastructure, HAPI FHIR provides a production-ready foundation. The server supports multiple backends including JPA/Hibernate for persistence.</p><p>Consider HAPI FHIR for self-hosted FHIR capabilities. For managed services, evaluate cloud provider offerings like AWS HealthLake or Azure Health Data Services.</p>"
Microsoft Healthcare Bot,trial,tools,new,"<p><strong>Microsoft Healthcare Bot</strong> provides an AI-powered virtual health assistant platform. Built on Azure, it enables building conversational experiences for symptom checking, appointment scheduling, and health information.</p><p>The platform includes medical intelligence capabilities, including symptom assessment based on clinical protocols. HIPAA compliance is available with appropriate Azure configurations.</p><p>We're trialling Healthcare Bot for patient engagement scenarios. Ensure clear disclosure that users are interacting with an AI system, not a healthcare provider.</p>"
Synthea,trial,tools,no change,"<p><strong>Synthea</strong> generates realistic but synthetic patient data in FHIR and other formats. This enables development and testing of healthcare applications without using real patient data.</p><p>For development environments, demos, and training, Synthea provides high-quality test data that mimics real clinical patterns without privacy concerns.</p><p>Customise Synthea configurations to match your target patient populations and clinical scenarios for more relevant test data.</p>"
OHDSI OMOP,trial,tools,moved in,"<p><strong>OHDSI OMOP</strong> (Observational Medical Outcomes Partnership) provides a common data model for observational healthcare data. It enables standardised analytics across diverse healthcare datasets.</p><p>The OHDSI community provides open-source tools for data transformation (ETL), analysis, and visualisation on OMOP-formatted data.</p><p>Consider OMOP for research and analytics use cases where data standardisation across sources is required. The learning curve is significant but the community support is strong.</p>"
Postman for FHIR Testing,adopt,tools,no change,"<p><strong>Postman</strong> with FHIR collections provides an excellent environment for testing healthcare APIs. Pre-built FHIR request collections simplify API exploration and testing.</p><p>For development and debugging of FHIR integrations, Postman's environment variables and collection runners enable comprehensive API testing.</p><p>Maintain Postman collections for your FHIR APIs as living documentation and regression test suites.</p>"
Clinical Quality Language (CQL),trial,tools,no change,"<p><strong>Clinical Quality Language (CQL)</strong> is a standard for expressing clinical knowledge in a computable format. It's used for quality measures, clinical decision support, and health analytics.</p><p>CQL enables authoring clinical logic that can be executed against FHIR and QDM data models. The language is increasingly required for electronic Clinical Quality Measures (eCQMs).</p><p>Invest in CQL expertise if your organisation develops clinical decision support or quality measures. The CQL ecosystem includes authoring tools and execution engines.</p>"
OpenMRS,assess,tools,no change,"<p><strong>OpenMRS</strong> is an open-source medical record system designed for resource-constrained environments. It's widely deployed in global health settings and provides a flexible platform for clinical data management.</p><p>For global health initiatives and research in underserved regions, OpenMRS provides a proven, customisable EHR foundation.</p><p>Evaluate OpenMRS for specific global health use cases. For standard commercial healthcare applications, consider commercial EHR integrations instead.</p>"
Docker for Healthcare Workloads,adopt,tools,no change,"<p><strong>Docker</strong> enables containerised deployment of healthcare applications with consistent environments across development and production. Container isolation supports multi-tenant healthcare platforms.</p><p>For HIPAA-compliant deployments, container orchestration platforms provide security boundaries and audit capabilities required for healthcare workloads.</p><p>Implement proper secrets management, network policies, and logging for healthcare containers. Consider managed Kubernetes services for production healthcare workloads.</p>"
Terraform for Healthcare Infrastructure,adopt,tools,no change,"<p><strong>Terraform</strong> enables Infrastructure as Code for healthcare cloud environments. Codified infrastructure supports compliance requirements by providing reproducible, auditable deployments.</p><p>Healthcare infrastructure requires specific compliance configurations - HIPAA-eligible services, encryption settings, and network controls. Terraform modules can encode these requirements consistently.</p><p>Develop reusable Terraform modules for compliant healthcare infrastructure patterns in your organisation.</p>"
